{
  "$schema": "https://json-schema.org/draft/2020-12/schema",
  "$id": "https://github.com/vpinball/pinmame-game-defs/schemas/harness-scenario.schema.json",
  "title": "PinMAME runtime harness scenario",
  "type": "object",
  "additionalProperties": false,
  "required": ["format", "version", "actions"],
  "properties": {
    "format": { "const": "pinmame-harness-scenario" },
    "version": { "const": 1 },
    "game": { "type": "string", "minLength": 1 },
    "notes": { "type": "string", "minLength": 1 },
    "switch_converter": {
      "description": "The driver's public switch conversion. 'sequential' (the default) admits -7 to 120. 'gts3' admits gts3_sw2m's numbers (-8 to -1, and 0 to 147 whose last digit is 0-7), and the harness refuses to touch a switch until PinmameGetHardwareGen() reports PINMAME_HARDWARE_GEN_GTS3.",
      "enum": ["sequential", "gts3"],
      "default": "sequential"
    },
    "initial_switches": {
      "type": "array",
      "items": { "$ref": "#/$defs/switchState" }
    },
    "watch_switches": {
      "type": "array",
      "uniqueItems": true,
      "items": { "$ref": "#/$defs/publicSwitchAddress" }
    },
    "actions": {
      "type": "array",
      "items": {
        "oneOf": [
          { "$ref": "#/$defs/pulse" },
          { "$ref": "#/$defs/setSwitch" },
          { "$ref": "#/$defs/pulseKey" },
          { "$ref": "#/$defs/setKey" },
          { "$ref": "#/$defs/pulseUntilDisplay" },
          { "$ref": "#/$defs/pulseUntilOutput" },
          { "$ref": "#/$defs/waitUntilOutput" },
          { "$ref": "#/$defs/wait" }
        ]
      }
    }
  },
  "$defs": {
    "publicSwitchAddress": {
      "description": "Union of the public-switch envelopes the harness knows to be safe: -7 to 120 for PinMAME's sequential converters, and -8 to 147 for gts3_sw2m. The harness re-checks every address against the scenario's switch_converter, and checks the running driver's generation before calling the unchecked native switch API with a converter-specific address.",
      "type": "integer",
      "minimum": -8,
      "maximum": 147
    },
    "switchState": {
      "type": "object",
      "additionalProperties": false,
      "required": ["switch", "state"],
      "properties": {
        "switch": { "$ref": "#/$defs/publicSwitchAddress" },
        "state": { "enum": [0, 1] }
      }
    },
    "pulse": {
      "type": "object",
      "additionalProperties": false,
      "required": ["type", "switch"],
      "properties": {
        "type": { "const": "pulse" },
        "label": { "type": "string", "minLength": 1 },
        "switch": { "$ref": "#/$defs/publicSwitchAddress" },
        "active_state": { "description": "Raw public level repeatedly applied during the pulse. A driver SWITCH_UPDATE callback can still overwrite this level between writes, so do not use direct pulses as evidence for driver-owned inputs.", "enum": [0, 1], "default": 1 },
        "hold_ms": { "type": "number", "exclusiveMinimum": 0, "default": 100 },
        "settle_s": { "type": "number", "minimum": 0, "default": 1.0 },
        "snapshot_while_held": { "type": "boolean", "default": false }
      }
    },
    "setSwitch": {
      "type": "object",
      "additionalProperties": false,
      "required": ["type", "switch", "state"],
      "properties": {
        "type": { "const": "set_switch" },
        "label": { "type": "string", "minLength": 1 },
        "switch": { "$ref": "#/$defs/publicSwitchAddress" },
        "state": { "enum": [0, 1] },
        "settle_s": { "type": "number", "minimum": 0, "default": 1.0 }
      }
    },
    "pulseKey": {
      "type": "object",
      "additionalProperties": false,
      "required": ["type", "key"],
      "properties": {
        "type": { "const": "pulse_key" },
        "label": { "type": "string", "minLength": 1 },
        "key": { "enum": ["balls_in_trough", "service_escape", "start", "coin_1", "service_green", "service_enter", "service_black", "service_up", "service_down", "launch", "coin_door", "left_flipper", "right_flipper", "left_action", "right_action", "service_select", "service_plus", "coin1", "coin2"] },
        "hold_ms": { "type": "number", "exclusiveMinimum": 0, "default": 100 },
        "settle_s": { "type": "number", "minimum": 0, "default": 1.0 },
        "snapshot_while_held": { "type": "boolean", "default": false }
      }
    },
    "setKey": {
      "type": "object",
      "additionalProperties": false,
      "required": ["type", "key", "state"],
      "properties": {
        "type": { "const": "set_key" },
        "label": { "type": "string", "minLength": 1 },
        "key": { "enum": ["balls_in_trough", "service_escape", "start", "coin_1", "service_green", "service_enter", "service_black", "service_up", "service_down", "launch", "coin_door", "left_flipper", "right_flipper", "left_action", "right_action", "service_select", "service_plus", "coin1", "coin2"] },
        "state": { "enum": [0, 1] },
        "settle_s": { "type": "number", "minimum": 0, "default": 1.0 }
      }
    },
    "pulseUntilDisplay": {
      "type": "object",
      "additionalProperties": false,
      "required": ["type", "texts"],
      "oneOf": [
        {
          "required": ["switch"],
          "not": { "required": ["key"] }
        },
        {
          "required": ["key"],
          "not": { "required": ["switch"] }
        }
      ],
      "allOf": [
        {
          "if": { "required": ["key"] },
          "then": { "not": { "required": ["active_state"] } }
        }
      ],
      "properties": {
        "type": { "const": "pulse_until_display" },
        "label": { "type": "string", "minLength": 1 },
        "switch": { "$ref": "#/$defs/publicSwitchAddress" },
        "key": { "enum": ["balls_in_trough", "service_escape", "start", "coin_1", "service_green", "service_enter", "service_black", "service_up", "service_down", "launch", "coin_door", "left_flipper", "right_flipper", "left_action", "right_action", "service_select", "service_plus", "coin1", "coin2"] },
        "active_state": { "description": "Raw public level repeatedly applied during each pulse. A driver SWITCH_UPDATE callback can still overwrite this level between writes, so do not use direct pulses as evidence for driver-owned inputs.", "enum": [0, 1], "default": 1 },
        "texts": {
          "type": "array",
          "minItems": 1,
          "uniqueItems": true,
          "items": { "type": "string", "minLength": 1 }
        },
        "max_pulses": { "type": "integer", "minimum": 1, "default": 20 },
        "hold_ms": { "type": "number", "exclusiveMinimum": 0, "default": 100 },
        "settle_s": { "type": "number", "minimum": 0, "default": 1.0 }
      }
    },
    "pulseUntilOutput": {
      "type": "object",
      "additionalProperties": false,
      "required": ["type", "channel", "addresses"],
      "oneOf": [
        {
          "required": ["switch"],
          "not": { "required": ["key"] }
        },
        {
          "required": ["key"],
          "not": { "required": ["switch"] }
        }
      ],
      "allOf": [
        {
          "if": { "required": ["key"] },
          "then": { "not": { "required": ["active_state"] } }
        }
      ],
      "properties": {
        "type": { "const": "pulse_until_output" },
        "label": { "type": "string", "minLength": 1 },
        "switch": { "$ref": "#/$defs/publicSwitchAddress" },
        "key": { "enum": ["balls_in_trough", "service_escape", "start", "coin_1", "service_green", "service_enter", "service_black", "service_up", "service_down", "launch", "coin_door", "left_flipper", "right_flipper", "left_action", "right_action", "service_select", "service_plus", "coin1", "coin2"] },
        "active_state": { "description": "Raw public level repeatedly applied during each pulse. A driver SWITCH_UPDATE callback can still overwrite this level between writes, so do not use direct pulses as evidence for driver-owned inputs.", "enum": [0, 1], "default": 1 },
        "channel": { "enum": ["solenoid", "lamp", "gi"] },
        "addresses": {
          "type": "array",
          "minItems": 1,
          "uniqueItems": true,
          "items": { "type": "integer" }
        },
        "max_pulses": { "type": "integer", "minimum": 1, "default": 20 },
        "hold_ms": { "type": "number", "exclusiveMinimum": 0, "default": 100 },
        "settle_s": { "type": "number", "minimum": 0, "default": 1.0 }
      }
    },
    "wait": {
      "type": "object",
      "additionalProperties": false,
      "required": ["type", "seconds"],
      "properties": {
        "type": { "const": "wait" },
        "label": { "type": "string", "minLength": 1 },
        "seconds": { "type": "number", "minimum": 0 }
      }
    },
    "waitUntilOutput": {
      "type": "object",
      "additionalProperties": false,
      "required": ["type", "channel", "addresses", "timeout_s"],
      "properties": {
        "type": { "const": "wait_until_output" },
        "label": { "type": "string", "minLength": 1 },
        "channel": { "enum": ["solenoid", "lamp", "gi"] },
        "addresses": {
          "type": "array",
          "minItems": 1,
          "uniqueItems": true,
          "items": { "type": "integer" }
        },
        "timeout_s": { "type": "number", "exclusiveMinimum": 0 },
        "active_only": { "type": "boolean", "default": false }
      }
    }
  }
}
