{
  "format": "pinmame-harness-scenario",
  "version": 1,
  "notes": "Diner power-up probe from the retained initialized NVRAM: Up/Down (L Ramp) switch (10) held from emulator start. The Auto-Up/Manual-Down switch (-6) is held at Auto-Up (1), the normal play position. No other host input; the harness never moves a ball or a mechanism.",
  "initial_switches": [
    {
      "switch": -6,
      "state": 1
    },
    {
      "switch": 10,
      "state": 1
    }
  ],
  "watch_switches": [
    -7,
    -6,
    10
  ],
  "actions": [
    {
      "type": "wait",
      "seconds": 30,
      "label": "observe power-up sequence"
    }
  ]
}
