{
  "actions": [
    {
      "label": "boot",
      "seconds": 25.0,
      "type": "wait"
    },
    {
      "hold_ms": 150,
      "label": "Escape out of the fresh-NVRAM loop",
      "settle_s": 20.0,
      "switch": 5,
      "type": "pulse"
    },
    {
      "label": "attract mode",
      "seconds": 20.0,
      "type": "wait"
    },
    {
      "hold_ms": 150,
      "label": "Enter 1 (towards MAIN MENU)",
      "settle_s": 3.0,
      "switch": 8,
      "type": "pulse"
    },
    {
      "hold_ms": 150,
      "label": "Enter 2 (towards MAIN MENU)",
      "settle_s": 3.0,
      "switch": 8,
      "type": "pulse"
    },
    {
      "hold_ms": 150,
      "label": "Up (P. PRINTOUTS)",
      "settle_s": 2.0,
      "switch": 7,
      "type": "pulse"
    },
    {
      "hold_ms": 150,
      "label": "Up (T. TESTS)",
      "settle_s": 2.0,
      "switch": 7,
      "type": "pulse"
    },
    {
      "hold_ms": 150,
      "label": "Enter (test menu, T.1 SWITCH EDGES)",
      "settle_s": 3.0,
      "switch": 8,
      "type": "pulse"
    },
    {
      "hold_ms": 150,
      "label": "Up (T.2)",
      "settle_s": 1.5,
      "switch": 7,
      "type": "pulse"
    },
    {
      "hold_ms": 150,
      "label": "Up (T.3)",
      "settle_s": 1.5,
      "switch": 7,
      "type": "pulse"
    },
    {
      "hold_ms": 150,
      "label": "Up (T.4)",
      "settle_s": 1.5,
      "switch": 7,
      "type": "pulse"
    },
    {
      "hold_ms": 150,
      "label": "Up (T.5)",
      "settle_s": 1.5,
      "switch": 7,
      "type": "pulse"
    },
    {
      "hold_ms": 150,
      "label": "Up (T.6)",
      "settle_s": 1.5,
      "switch": 7,
      "type": "pulse"
    },
    {
      "hold_ms": 150,
      "label": "Up (T.7)",
      "settle_s": 1.5,
      "switch": 7,
      "type": "pulse"
    },
    {
      "hold_ms": 150,
      "label": "Up (T.8)",
      "settle_s": 1.5,
      "switch": 7,
      "type": "pulse"
    },
    {
      "hold_ms": 150,
      "label": "Up (T.9)",
      "settle_s": 1.5,
      "switch": 7,
      "type": "pulse"
    },
    {
      "hold_ms": 150,
      "label": "Up (T.10)",
      "settle_s": 1.5,
      "switch": 7,
      "type": "pulse"
    },
    {
      "hold_ms": 150,
      "label": "Up (T.11)",
      "settle_s": 1.5,
      "switch": 7,
      "type": "pulse"
    },
    {
      "hold_ms": 150,
      "label": "Up (T.12)",
      "settle_s": 1.5,
      "switch": 7,
      "type": "pulse"
    },
    {
      "hold_ms": 150,
      "label": "Enter (start T.12)",
      "settle_s": 3.0,
      "switch": 8,
      "type": "pulse"
    },
    {
      "hold_ms": 150,
      "label": "T.12 Up 1",
      "settle_s": 3.0,
      "switch": 7,
      "type": "pulse"
    },
    {
      "hold_ms": 150,
      "label": "T.12 Up 2",
      "settle_s": 3.0,
      "switch": 7,
      "type": "pulse"
    },
    {
      "hold_ms": 150,
      "label": "T.12 Up 3",
      "settle_s": 3.0,
      "switch": 7,
      "type": "pulse"
    },
    {
      "hold_ms": 150,
      "label": "T.12 Up 4",
      "settle_s": 3.0,
      "switch": 7,
      "type": "pulse"
    },
    {
      "hold_ms": 150,
      "label": "T.12 Up 5",
      "settle_s": 3.0,
      "switch": 7,
      "type": "pulse"
    },
    {
      "hold_ms": 150,
      "label": "T.12 Up 6",
      "settle_s": 3.0,
      "switch": 7,
      "type": "pulse"
    },
    {
      "hold_ms": 150,
      "label": "T.12 Up 7",
      "settle_s": 3.0,
      "switch": 7,
      "type": "pulse"
    },
    {
      "hold_ms": 150,
      "label": "T.12 Up 8",
      "settle_s": 3.0,
      "switch": 7,
      "type": "pulse"
    }
  ],
  "format": "pinmame-harness-scenario",
  "initial_switches": [
    {
      "state": 0,
      "switch": 22
    }
  ],
  "notes": "Boot a Demolition Man ROM from an empty NVRAM with the coin door open and PinMAME's built-in mechanisms enabled (--handle-mechanics 15); the scenario names no game. Open T.12 FLIPPER COIL, then press Up 8 times with 3 s between presses, recording the winding the ROM names and the public output it pulses.",
  "version": 1
}
